path,domain,state,priority,owner,last_reviewed,next_action,notes
"data/core/property/inventory/pending/inventory.md",property_inventory,inbox,P1,"Omar+Agent",2026-02-13,"classify canonical vs legacy role","cross-domain summary file; isolated in pending"
"data/core/property/inventory/pending/amenities.md",amenities,planned,P1,"Omar+Agent",2026-02-13,"create contract + reconciliation log","next domain after rooms"
"data/core/property/inventory/pending/facilities.md",facilities,planned,P1,"Omar+Agent",2026-02-13,"create contract + reconciliation log","target after amenities"
"data/core/property/inventory/pending/beds.md",beds,inbox,P2,"Omar+Agent",2026-02-13,"schema triage","unclear if canonical standalone or subordinate to rooms"
"data/core/property/inventory/backups/rooms",inventory_backups,planned,P2,"Omar+Agent",2026-02-13,"define backup retention policy","isolated from canonical rooms folder"
"data/finance",finance,inbox,P2,"Omar+Agent",2026-02-13,"inventory and classify files","domain not yet onboarded to canonical workflow"
"origin/main",scm,working,P1,"Omar+Agent",2026-02-13,"non-destructive integration plan","remote main has independent history; bootstrap branch is synced"
